{
  "work_unit": "work-unit-178-test-fixtures",
  "title": "Schema validation at ingestion entry point",
  "behavior_form": "scenario",
  "scenarios": [
    {
      "name": "reject-missing-required-field",
      "criterion": "Records missing required fields are rejected with a 400 status",
      "given": "A record missing the 'id' field is submitted",
      "when": "The ingestion endpoint receives the record",
      "then": "The endpoint returns 400 with a validation error"
    },
    {
      "name": "pass-valid-record",
      "criterion": "Valid records pass through unchanged",
      "given": "A record with all required fields and valid types",
      "when": "The ingestion endpoint receives the record",
      "then": "The record is forwarded to the processing pipeline unchanged"
    }
  ]
}
