{
  "work_unit": "work-unit-454-runtime-gate-form",
  "title": "Documentation-deliverable gate-form behavior",
  "behavior_form": "gate",
  "gates": [
    {
      "name": "gate-form behavior artifacts stay schema-valid",
      "criterion": "A runtime-backed documentation-deliverable work-unit delivers its behavior dimension without scenarios.",
      "category": "structural",
      "check": "Validate the gate-form behavior-contract artifact against the schema."
    },
    {
      "name": "gate-form sequencing does not fabricate scenarios",
      "criterion": "Plan, implement, and verify sequence on the gate form.",
      "category": "coherence",
      "check": "Drive the scoped runtime session with gate-form artifacts only."
    }
  ]
}
